{
  "$schema": "http://json-schema.org/draft-07/schema#",
  "$id": "https://databricks-solutions.github.io/consort/schemas/step-manifest.schema.json",
  "title": "StepManifest",
  "description": "The DATA face of one step in the orchestrator's standard (Template Method) execution: its logical inputs, its outputs (with validator NAMES resolved from the code registry), its routing map, its agent levers, and any post-turn CLIs. The StepExecutor reads this to drive the fixed phases; only validator fn bodies and the agent spawn stay code.",
  "type": "object",
  "required": ["id", "role", "match", "inputs", "outputs", "routing", "agentOptions"],
  "properties": {
    "id": {
      "type": "string",
      "minLength": 1,
      "description": "Stable manifest id (e.g. spec-author-breakdown)."
    },
    "role": {
      "type": "string",
      "minLength": 1,
      "description": "The --agent role this step invokes."
    },
    "match": {
      "type": "object",
      "description": "How an action maps to this manifest: a STRICT SUBSET of a WorkflowAction. Every field present here must equal the action's field for a match. The loader rejects an ambiguous overlap (two manifests matching one action).",
      "minProperties": 1,
      "properties": {
        "kind": { "type": "string" }
      },
      "additionalProperties": true
    },
    "inputs": {
      "type": "array",
      "description": "The logical inputs the orchestrator resolves from .consort and PROVIDES to the step (contents, keyed by id).",
      "items": {
        "type": "object",
        "required": ["id", "source"],
        "properties": {
          "id": { "type": "string", "minLength": 1, "description": "Logical input id the contents are handed back under." },
          "source": { "type": "string", "minLength": 1, "description": ".consort source locator, e.g. feature:product-overview.md." },
          "optional": { "type": "boolean", "description": "When true, a MISSING source is skipped (not handed back) instead of failing the turn , for an input that legitimately may be absent (e.g. design-guide.json on a no-frontend project). Default false: a missing required input fails loud." },
          "description": { "type": "string", "description": "Human description for diagnostics." }
        },
        "additionalProperties": false
      }
    },
    "preconditions": {
      "type": "array",
      "description": "The pre-conditions the orchestrator PREPARES (via the preparer registry) and appends to the step's prompt before dispatch: the pre-extracted context-pack (rubric + module layout) and, for assess, the green-failure advisory. LOGICAL (by kind), never authored, projected deterministically from on-disk .consort. Absent = an affirmative 'nothing'; a declared preparer that yields empty is logged as an anomaly.",
      "items": {
        "type": "object",
        "required": ["id", "kind"],
        "properties": {
          "id": { "type": "string", "minLength": 1, "description": "Key the prepared block is handed back under." },
          "kind": { "type": "string", "minLength": 1, "description": "Preparer kind resolved from the preparer registry (context-pack | green-failure-advisory)." },
          "description": { "type": "string" },
          "position": { "type": "string", "enum": ["prepend", "append"], "description": "WHERE the prepared block sits relative to the base prompt: 'prepend' (before the directive, e.g. the green-failure advisory) or 'append' (after, e.g. the context-pack). Default 'append'." },
          "options": { "type": "object", "description": "Preparer-specific knobs, e.g. { \"skipTestLoop\": true } for context-pack." }
        },
        "additionalProperties": false
      }
    },
    "outputs": {
      "type": "array",
      "description": "The logical outputs the step produces into its workspace. Each declares an in-code conformance validator BY NAME (resolved from validator-registry.ts). May be empty for a turn verified by cycle records rather than a static artifact.",
      "items": {
        "type": "object",
        "required": ["id", "filename", "validator"],
        "properties": {
          "id": { "type": "string", "minLength": 1 },
          "filename": { "type": "string", "minLength": 1, "description": "Artifact filename within the provided workspace." },
          "validator": { "type": "string", "minLength": 1, "description": "Registered OutputValidator name (validator-registry.ts). resolveValidator throws loud on an unknown name." },
          "channel": { "type": "string", "enum": ["product", "artifact", "meta"], "description": "WHICH channel this output lands in (absent = the primary workspace root, byte-identical to a single-root turn). product = the application deliverable that accumulates across build turns + gets committed/migrated/deployed (app/, tests/, migrations); MUST be uncontained (the real code tree; a per-experiment worktree when experiments run in parallel), since each build turn reads prior turns' code. artifact = the .consort design documents (feature-spec/architecture/test-list/design-guide) the design roles author; small + per-feature, so it MAY be contained (resolved under artifactDir when the orchestrator provisions one, else the workspace). meta = the orchestrator's bookkeeping about the turn (raw agent report, reflect verdict, assess marker), whose CONFORMANCE the orchestrator owns; contained (resolved under metaDir when provisioned, else the workspace). Each root defaults to workspaceDir, so an untagged / un-provisioned turn is byte-identical." },
          "optional": { "type": "boolean", "description": "The turn LEGITIMATELY may not produce this output (a self-heal turn writes its marker on one branch of its judgment + escalates to a human on the other). ABSENT = a clean pass (the escalation/no-op route is preserved); PRESENT = still validated (a malformed present marker is a hard reject). Default (absent/false) = required, the design-lane norm." },
          "description": { "type": "string" }
        },
        "additionalProperties": false
      }
    },
    "routing": {
      "type": "object",
      "description": "The routing proposal map keyed by StepOutcome. Each outcome maps to a next-move descriptor the contract's route() emits; the orchestrator's validateAndBound reconciles it with the pure allowed transition. A produced route of \"state-derived\" defers entirely to the pure transition.",
      "required": ["produced"],
      "properties": {
        "produced": { "$ref": "#/definitions/routeTarget" },
        "blocked": { "$ref": "#/definitions/routeTarget" },
        "revise": { "$ref": "#/definitions/routeTarget" },
        "escalate": { "$ref": "#/definitions/routeTarget" }
      },
      "additionalProperties": false
    },
    "agentOptions": {
      "type": "object",
      "description": "The agent levers the StepExecutor builds AgentLevers from for the dispatch-agent phase.",
      "required": ["session"],
      "properties": {
        "model": { "type": "string" },
        "effort": { "type": "string", "enum": ["default", "low", "medium", "high", "xhigh", "max"] },
        "session": { "type": "string", "enum": ["fresh", "resume"] },
        "resumeKeyFrom": { "type": "string", "enum": ["role", "story", "feature", "none"] },
        "toolScope": {
          "type": "object",
          "properties": {
            "allowed": { "type": "array", "items": { "type": "string" } },
            "disallowed": { "type": "array", "items": { "type": "string" } }
          },
          "additionalProperties": false
        },
        "fallbackModel": { "type": "string" },
        "maxBudgetUsd": { "type": "number", "minimum": 0 }
      },
      "additionalProperties": false
    },
    "postTurn": {
      "type": "array",
      "description": "Role-specific deterministic CLIs run in the record/log phase (reset/sync-breakdown, test-list, cycle stamps).",
      "items": {
        "type": "object",
        "required": ["bin", "args"],
        "properties": {
          "bin": { "type": "string", "minLength": 1 },
          "args": { "type": "array", "items": { "type": "string" } },
          "when": { "type": "string", "enum": ["before", "after"] }
        },
        "additionalProperties": false
      }
    },
    "agent": {
      "type": "object",
      "description": "WHICH concrete StepAgent this step uses + that agent's config, resolved via the agent catalogue. `kind` names a catalogue entry (claude | replay | mock); `config` is that kind's knobs. The ENV a kind needs (corpus root, kit dir) is supplied by the runner, NOT here.",
      "required": ["kind", "config"],
      "properties": {
        "kind": { "type": "string", "minLength": 1, "description": "Catalogue kind: claude (real spawn) | replay (recorded artifacts) | mock (fixtures)." },
        "config": { "type": "object", "description": "The kind's own config (claude levers / replay seeds / mock outputs)." }
      },
      "additionalProperties": false
    }
  },
  "additionalProperties": false,
  "definitions": {
    "routeTarget": {
      "description": "Where an outcome proposes to go. Either a concrete WorkflowAction under `next`, the sentinel string \"state-derived\" (defer to the pure transition), or a bare flag object (retry/gate) the contract interprets.",
      "type": "object",
      "properties": {
        "next": {},
        "retry": { "type": "boolean" },
        "gate": { "type": "string" }
      },
      "additionalProperties": true
    }
  }
}
