{
  "id": "ux-designer",
  "role": "ux-designer",
  "match": { "kind": "invoke-role", "role": "ux-designer" },
  "inputs": [
    { "id": "design-guideline", "source": "feature:design-brief.md", "description": "The HIL design brief the UX Designer extracts the look FROM (design-brief.md)." },
    { "id": "product-overview", "source": "feature:product-overview.md", "description": "The PO's product overview , which stories produce screens (product-overview.md)." }
  ],
  "outputs": [
    { "id": "design-guide", "filename": "design-guide.json", "channel": "artifact", "validator": "designGuideConformant", "description": "The machine-checkable design tokens + components (design-guide.schema.json). The narrative design-guide.md + ia.md are authored alongside but the JSON is the gated artifact." },
    { "id": "agent-log", "filename": "agent-log.jsonl", "channel": "meta", "validator": "uxDesignerLoggedAuthoring", "description": "The UX Designer's structured log of what it authored (shared agent-log script; agent-log-event.schema.json)." }
  ],
  "routing": {
    "produced": { "next": "state-derived" }
  },
  "agentOptions": {
    "model": "opus",
    "effort": "low",
    "session": "fresh",
    "resumeKeyFrom": "role"
  }
}
