{
  "id": "navigator-assess-deploy",
  "role": "navigator",
  "match": { "kind": "invoke-role", "role": "navigator", "buildMode": "assess-deploy" },
  "inputs": [
    { "id": "deploy-verify-assess", "source": "story:deploy-verify-assess.json", "description": "The story-level deploy-verify failure marker the Navigator scopes for contamination-fragile tests." }
  ],
  "outputs": [
    { "id": "scope", "filename": "deploy-verify-scope.json", "channel": "meta", "validator": "deployVerifyScopeConformant", "optional": true, "description": "The scope directives the Driver's refactor-deploy reads , OPTIONAL: the Navigator writes it when it confirms contamination-fragile tests, and writes NOTHING (its veto -> escalate) when it judges the classifier wrong. Absent = a clean pass (the escalation route); present = validated (a malformed scope is a hard reject)." }
  ],
  "routing": {
    "produced": { "next": "state-derived" }
  },
  "agentOptions": {
    "model": "sonnet",
    "effort": "default",
    "session": "resume",
    "resumeKeyFrom": "story"
  },
  "postTurn": [
    { "bin": "@build-cycle", "args": [], "when": "after" }
  ]
}
